{
  "$schema": "https://json-schema.org/draft/2020-12/schema",
  "$id": "https://flowmemory.local/schemas/flowmemory/production-block-body.schema.json",
  "title": "FlowChain Block Body V0",
  "type": "object",
  "additionalProperties": false,
  "required": [
    "schema",
    "header",
    "transactions",
    "receipts",
    "events",
    "bridgeEvidence",
    "stateRootManifest"
  ],
  "properties": {
    "schema": {
      "const": "flowchain.production_l1.block_body.v0",
      "x-owner": "runtime"
    },
    "header": {
      "$ref": "https://flowmemory.local/schemas/flowmemory/production-block-header.schema.json",
      "x-owner": "runtime"
    },
    "transactions": {
      "type": "array",
      "minItems": 1,
      "items": {
        "$ref": "https://flowmemory.local/schemas/flowmemory/production-transaction-envelope.schema.json"
      },
      "x-owner": "runtime"
    },
    "receipts": {
      "type": "array",
      "minItems": 1,
      "items": {
        "$ref": "https://flowmemory.local/schemas/flowmemory/production-receipt.schema.json"
      },
      "x-owner": "runtime"
    },
    "events": {
      "type": "array",
      "minItems": 1,
      "items": {
        "$ref": "https://flowmemory.local/schemas/flowmemory/production-event.schema.json"
      },
      "x-owner": "indexer"
    },
    "bridgeEvidence": {
      "type": "array",
      "items": {
        "$ref": "https://flowmemory.local/schemas/flowmemory/production-bridge-evidence.schema.json"
      },
      "x-owner": "bridge"
    },
    "stateRootManifest": {
      "$ref": "https://flowmemory.local/schemas/flowmemory/production-state-root-manifest.schema.json",
      "x-owner": "runtime"
    }
  },
  "$defs": {
    "hex32": {
      "type": "string",
      "pattern": "^0x[0-9a-fA-F]{64}$"
    },
    "address": {
      "type": "string",
      "pattern": "^0x[0-9a-fA-F]{40}$"
    },
    "publicKey": {
      "type": "string",
      "pattern": "^0x(02|03)[0-9a-fA-F]{64}$"
    },
    "uintString": {
      "type": "string",
      "pattern": "^(0|[1-9][0-9]*)$"
    },
    "isoTime": {
      "type": "string",
      "format": "date-time"
    },
    "networkProfile": {
      "type": "string",
      "enum": [
        "flowchain-local-private",
        "flowchain-local-multinode",
        "flowchain-base8453-pilot"
      ]
    },
    "payloadType": {
      "type": "string",
      "enum": [
        "native_transfer",
        "faucet_funding",
        "bridge_credit",
        "token_launch",
        "token_mint",
        "token_transfer",
        "pool_create",
        "add_liquidity",
        "remove_liquidity",
        "swap",
        "withdrawal_intent",
        "validator_authority_config",
        "finality_vote",
        "finality_certificate",
        "agent_account_update",
        "model_passport_update",
        "work_receipt_update",
        "artifact_availability_proof_update",
        "verifier_module_update",
        "verifier_report_update",
        "memory_cell_update",
        "challenge_update",
        "finality_receipt_update"
      ]
    },
    "eventType": {
      "type": "string",
      "enum": [
        "NativeTransferRecorded",
        "FaucetFundingRecorded",
        "BridgeCreditApplied",
        "TokenLaunched",
        "TokenMinted",
        "TokenTransferred",
        "PoolCreated",
        "LiquidityAdded",
        "LiquidityRemoved",
        "SwapExecuted",
        "WithdrawalIntentRecorded",
        "ValidatorAuthorityConfigured",
        "FinalityVoteRecorded",
        "FinalityCertificateRecorded",
        "ObjectLifecycleUpdated"
      ]
    },
    "stateComponent": {
      "type": "string",
      "enum": [
        "accounts",
        "balances",
        "tokens",
        "pools",
        "lp_positions",
        "bridge_credits",
        "withdrawals",
        "object_store",
        "finality",
        "validator_state"
      ]
    }
  }
}
