{
  "schema": "flowchain.production_l1.block_body.v0",
  "header": {
    "schema": "flowchain.production_l1.block_header.v0",
    "chainId": "7428453",
    "networkProfile": "flowchain-base8453-pilot",
    "genesisHash": "0x0826d4c5093c967d57dd5239b8c24e089dc898942291b5f3050a129887041e7f",
    "height": "1",
    "parentHash": "0x0000000000000000000000000000000000000000000000000000000000000000",
    "timestamp": "2026-05-13T15:00:02.000Z",
    "proposer": "0xef8fcf1e5560df82860c4de608453cc69a07478b1c7472b6fa7f5834d7d0c46d",
    "txRoot": "0x78865e2cba533f19d123cd74fc14b52492b8a00af6b6bf7260c5341ea99f9d56",
    "receiptRoot": "0x3eaf7f52991cf4caa39ecfa74a06243fc18bdac9df1dee22c85fef6fc78116f5",
    "eventRoot": "0x9de2f0ad4bc77fcb2b5804db0012545b27f3f4e89124bb7a218f0d7230b77f3b",
    "stateRoot": "0x716ccaf7e8946591973d4614d41ba39c047ef7e89bd67d62f1aa6d90b99133ef",
    "evidenceRoot": "0xfe9913ee8132ffb0ea7dea147bd15f084ca76d057a62ecc9917117e7f8a54b60",
    "finalizedHeight": "0",
    "protocolVersion": "flowchain.private_local_l1.protocol.v0",
    "blockHash": "0x4e38335dd2b0163f75d631c9b6648b6cc59f83e2b3a32e72d301322ac27148c4"
  },
  "transactions": [
    {
      "schema": "flowchain.production_l1.transaction_envelope.v0",
      "txId": "0x18e97cdd0f9b8222ae270a034b8b26daf6d73c43c425d0593100b1d889563930",
      "protocolVersion": "flowchain.private_local_l1.protocol.v0",
      "chainId": "7428453",
      "networkProfile": "flowchain-base8453-pilot",
      "genesisHash": "0x0826d4c5093c967d57dd5239b8c24e089dc898942291b5f3050a129887041e7f",
      "nonce": "1",
      "nonceDomain": "0x02a7170b32f06e676036e7f0df7a0c1b5aed6d97730abc30f29e6a6d22b610ac",
      "signer": {
        "accountId": "0xd6d0a8eb15ca2da58ecde78beb56830564ea3302b3af4215cdccb3a08ff34908",
        "publicKey": "0x02a332e6b5637c5584cf1b19a24410a74a86715d1d054f5bf1f1054ed789fae974",
        "address": "0x160c4dcc0bb4bdc9bdbdd3b652dacdb0a95731d3",
        "role": "user"
      },
      "payloadType": "native_transfer",
      "payloadHash": "0xb314ed92273ef9aed93bcc16e4989067a8d7dbd362373e4f15bdf2ad15d2b639",
      "payload": {
        "schema": "flowchain.production_l1.transaction_payload.v0",
        "payloadType": "native_transfer",
        "payloadId": "0xc812c43f614a33562fbdd8ea7c02ba4839f87e45f201bbeb8fd08e080b88d2fa",
        "actorAccountId": "0xd6d0a8eb15ca2da58ecde78beb56830564ea3302b3af4215cdccb3a08ff34908",
        "accountNonce": "1",
        "details": {
          "fromAccountId": "0xd6d0a8eb15ca2da58ecde78beb56830564ea3302b3af4215cdccb3a08ff34908",
          "toAccountId": "0xc687acd2a8f82c43e7b5e5fc8c3df132aa69becb29a71abcdfe6461a2e6e774a",
          "assetId": "0xa70acd8537f968b85bbfcff11f26a46376af5de590645cfd4976f1382794c024",
          "amount": "10000",
          "memoHash": "0x9284d3dc2a7d698ae915b37d7e2811f36db10682e82d56aa6bd7664d1220ef06"
        },
        "preconditions": [
          "payload_type:native_transfer",
          "account_nonce:1"
        ],
        "stateWrites": [
          "native_transfer:state_write:0xc812c43f614a33562fbdd8ea7c02ba4839f87e45f201bbeb8fd08e080b88d2fa"
        ],
        "balanceChanges": [
          {
            "accountId": "0xd6d0a8eb15ca2da58ecde78beb56830564ea3302b3af4215cdccb3a08ff34908",
            "assetId": "0xa70acd8537f968b85bbfcff11f26a46376af5de590645cfd4976f1382794c024",
            "delta": "-10000"
          },
          {
            "accountId": "0xc687acd2a8f82c43e7b5e5fc8c3df132aa69becb29a71abcdfe6461a2e6e774a",
            "assetId": "0xa70acd8537f968b85bbfcff11f26a46376af5de590645cfd4976f1382794c024",
            "delta": "10000"
          }
        ],
        "nonceChange": {
          "accountId": "0xd6d0a8eb15ca2da58ecde78beb56830564ea3302b3af4215cdccb3a08ff34908",
          "before": "1",
          "after": "2"
        },
        "emittedEventTypes": [
          "NativeTransferRecorded"
        ],
        "indexKeys": [
          {
            "key": "payloadType",
            "value": "native_transfer"
          },
          {
            "key": "actorAccountId",
            "value": "0xd6d0a8eb15ca2da58ecde78beb56830564ea3302b3af4215cdccb3a08ff34908"
          }
        ],
        "localOnly": true,
        "productionReady": false
      },
      "fee": {
        "mode": "local_gas_units",
        "gasLimit": "1000000",
        "maxFeePerGas": "0",
        "localExecutionCostLimit": "1000000"
      },
      "expiration": {
        "validAfterBlock": "0",
        "validUntilBlock": "100",
        "expiresAtUnixMs": "1778691600000"
      },
      "signature": {
        "scheme": "fixture-secp256k1-digest-only",
        "signingDigest": "0x1a4bd0898df04f0e790a8256a7d254412d22e06326f8b2b46ba4039e0fbfe2ce",
        "value": "0x1a4bd0898df04f0e790a8256a7d254412d22e06326f8b2b46ba4039e0fbfe2cedbb4b0f74b3d6f6b6c9cdea4aaaf227cc71941d46a3a2e4826f7ec07e15a7d2a"
      }
    },
    {
      "schema": "flowchain.production_l1.transaction_envelope.v0",
      "txId": "0x74b37fa211b380912250d589cbd52a7f08ef9e34ec68bcf034ef38d07697465a",
      "protocolVersion": "flowchain.private_local_l1.protocol.v0",
      "chainId": "7428453",
      "networkProfile": "flowchain-base8453-pilot",
      "genesisHash": "0x0826d4c5093c967d57dd5239b8c24e089dc898942291b5f3050a129887041e7f",
      "nonce": "2",
      "nonceDomain": "0x02a7170b32f06e676036e7f0df7a0c1b5aed6d97730abc30f29e6a6d22b610ac",
      "signer": {
        "accountId": "0xd6d0a8eb15ca2da58ecde78beb56830564ea3302b3af4215cdccb3a08ff34908",
        "publicKey": "0x02a332e6b5637c5584cf1b19a24410a74a86715d1d054f5bf1f1054ed789fae974",
        "address": "0x160c4dcc0bb4bdc9bdbdd3b652dacdb0a95731d3",
        "role": "deployer"
      },
      "payloadType": "faucet_funding",
      "payloadHash": "0x678de8bb69e2e7585fbbd059f014e9f3f7af59b970e55a7a1817709bf3a74c4b",
      "payload": {
        "schema": "flowchain.production_l1.transaction_payload.v0",
        "payloadType": "faucet_funding",
        "payloadId": "0xa4e0c6b866e9ee38c2b31dd6a928388a7389c8058648609c80d490ce77f40073",
        "actorAccountId": "0xd6d0a8eb15ca2da58ecde78beb56830564ea3302b3af4215cdccb3a08ff34908",
        "accountNonce": "2",
        "details": {
          "faucetId": "0x268c55ac11ea534f33a96f4738b075648a9603e41cc7054ee03a8eb7f0e55c34",
          "toAccountId": "0xc687acd2a8f82c43e7b5e5fc8c3df132aa69becb29a71abcdfe6461a2e6e774a",
          "assetId": "0xa70acd8537f968b85bbfcff11f26a46376af5de590645cfd4976f1382794c024",
          "amount": "5000",
          "reasonHash": "0x8934e316445b4e6bcee5226b067a5eddc19fa23a869e272feb6be378dae8ed48",
          "localOnly": true
        },
        "preconditions": [
          "payload_type:faucet_funding",
          "account_nonce:2"
        ],
        "stateWrites": [
          "faucet_funding:state_write:0xa4e0c6b866e9ee38c2b31dd6a928388a7389c8058648609c80d490ce77f40073"
        ],
        "balanceChanges": [
          {
            "accountId": "0xc687acd2a8f82c43e7b5e5fc8c3df132aa69becb29a71abcdfe6461a2e6e774a",
            "assetId": "0xa70acd8537f968b85bbfcff11f26a46376af5de590645cfd4976f1382794c024",
            "delta": "5000"
          }
        ],
        "nonceChange": {
          "accountId": "0xd6d0a8eb15ca2da58ecde78beb56830564ea3302b3af4215cdccb3a08ff34908",
          "before": "2",
          "after": "3"
        },
        "emittedEventTypes": [
          "FaucetFundingRecorded"
        ],
        "indexKeys": [
          {
            "key": "payloadType",
            "value": "faucet_funding"
          },
          {
            "key": "actorAccountId",
            "value": "0xd6d0a8eb15ca2da58ecde78beb56830564ea3302b3af4215cdccb3a08ff34908"
          }
        ],
        "localOnly": true,
        "productionReady": false
      },
      "fee": {
        "mode": "local_gas_units",
        "gasLimit": "1000000",
        "maxFeePerGas": "0",
        "localExecutionCostLimit": "1000000"
      },
      "expiration": {
        "validAfterBlock": "0",
        "validUntilBlock": "100",
        "expiresAtUnixMs": "1778691600000"
      },
      "signature": {
        "scheme": "fixture-secp256k1-digest-only",
        "signingDigest": "0x5e1b2659f86f1f99703c8b54d0721b51c41eec36ba6ae9d89f1ca56df045092d",
        "value": "0x5e1b2659f86f1f99703c8b54d0721b51c41eec36ba6ae9d89f1ca56df045092d387e84a80721b4291186c3a02d8a0511410504f1a702e1930a266c62333635e3"
      }
    },
    {
      "schema": "flowchain.production_l1.transaction_envelope.v0",
      "txId": "0x36f329a0663b99955a5778cefa40aed22fbafedea1230e559253aef782bbe42a",
      "protocolVersion": "flowchain.private_local_l1.protocol.v0",
      "chainId": "7428453",
      "networkProfile": "flowchain-base8453-pilot",
      "genesisHash": "0x0826d4c5093c967d57dd5239b8c24e089dc898942291b5f3050a129887041e7f",
      "nonce": "1",
      "nonceDomain": "0x346974a0aa8346f9759dde1d56bb8962a36eb013ca5e7f8c1b8e673fcfebd08a",
      "signer": {
        "accountId": "0xb456f55c243edcb1372f27f199f9e68b25d0909f5d2d90ec4e20fbe6de7098b4",
        "publicKey": "0x02f90ad32b15b53c0e4abd4f2f0de6db96dbe0adee1dab1736b0cf596070f7ef05",
        "address": "0x633621fec8e01f8346130d81c26be8e33d1dcea9",
        "role": "relayer"
      },
      "payloadType": "bridge_credit",
      "payloadHash": "0x5945c72f2b23e8f5f301a7610a066f516c26f2d64245f94bb59821e013861979",
      "payload": {
        "schema": "flowchain.production_l1.transaction_payload.v0",
        "payloadType": "bridge_credit",
        "payloadId": "0x7a8668dcd2bffa80eb280031bd7757ecbaf8cd880d766d04e9bfc1a5bd8c4d66",
        "actorAccountId": "0xb456f55c243edcb1372f27f199f9e68b25d0909f5d2d90ec4e20fbe6de7098b4",
        "accountNonce": "1",
        "details": {
          "bridgeEvidenceId": "0x013b5052df9be23c0816f77258d50bddfad0d73eb62af5fdd96a0b45d16fee21",
          "observationId": "0x070736a82e7dad444266af15ec8b521beba7c08502be2aeecb32c0f7f41b68d3",